{
  "schemaVersion": "v1",
  "incidentId": "inc-20250701-0001",
  "app": "demo-app",
  "env": "local",
  "severity": "high",
  "type": "exception",
  "firstSeenAt": "2025-07-01T10:23:11Z",
  "count": 3,
  "signature": "error servlet service() ... thrown exception request processing failed nested exception is java.lang.illegalstateexception boom with root cause",
  "logExcerpt": "2025-07-01 10:23:11.123 ERROR 12345 --- [http-nio-8080-exec-1] c.e.demo.web.FlakyController   : Servlet.service() for servlet [dispatcherServlet] in context with path [] threw exception [Request processing failed; nested exception is java.lang.IllegalStateException: boom] with root cause\njava.lang.IllegalStateException: boom\n\tat c.e.demo.service.FlakyService.boom(FlakyService.java:31)\n\tat c.e.demo.web.FlakyController.boom(FlakyController.java:36)",
  "metrics": {
    "ts": "2025-07-01T10:23:12Z",
    "cpuPct": 12.5,
    "memUsedMb": 1024.0,
    "memTotalMb": 8192.0,
    "memUsedPct": 12.5,
    "loadAvg1": 0.4
  },
  "status": "new"
}
